{
  "spec_id": "certification-attestation",
  "schema_version": "1.0.0",
  "issued_at": "2026-03-01T00:00:00Z",
  "tier": "enterprise",
  "integration": {
    "name": "acme-ai-platform",
    "version": "2.4.1",
    "vendor_id": "c16922ef-95de-4d43-ac62-a279fac7e14f"
  },
  "evidence_hashes": {
    "anchor_payload": "d3babd2037014f64b8a9c529ac0ae3dd5a4ea1cfb88bb8a6d4bbccc71c73cc5c",
    "anchor_receipt": "6a1f278dfe6f130abd18b93ba68039914f337a62d25fa65b59e35f7044896bc6",
    "attestation_manifest": "6df0dcda0cb0b0eda66245a71f5bc39c92f65245b88bf4e360b3c316d2dd8018",
    "meta": "a1b2c3d4e5f6789012345678901234567890123456789012345678901234abcd",
    "proof_manifest": "4e4cd3656219d8d8b52e75c94f20ce03f2ee592e71d8d6f49c17facfdbf960af",
    "verification_output": "b2c3d4e5f6789012345678901234567890123456789012345678901234abcdef"
  },
  "proof_surface_url": "https://specora.ai/proof",
  "ci_badges": [
    "https://github.com/acme/ai-platform/actions/workflows/specora-verify.yml/badge.svg"
  ],
  "verified_by": {
    "node_verifier_commit": "abc123def456",
    "specora_verify_version": "1.2.0"
  },
  "requirements_met": [
    "RCP-24",
    "RCP-48",
    "RCP-66",
    "RCP-79",
    "RCP-86",
    "RCP-87",
    "RCP-88",
    "RCP-94",
    "RCP-95",
    "RCP-96",
    "RCP-97",
    "RCP-98",
    "RCP-99",
    "RCP-100",
    "RCP-101",
    "RCP-103",
    "RCP-104",
    "RCP-105",
    "RCP-106",
    "RCP-107"
  ],
  "requirements_missing": [],
  "notes": null
}
